{"$schema":"https://json-schema.org/draft/2020-12/schema","$id":"lobster-runtime/v3","type":"object","additionalProperties":false,"required":["browser_engine","browser_version","dependency_fingerprint","fingerprint_spec","finished_at","project_fingerprint","project_revision","run_id","runner","runner_version","scenario_hash","scenarios","schema","started_at","status","target"],"properties":{"schema":{"const":"lobster-runtime/v3"},"status":{"enum":["PASS","FAIL","UNAVAILABLE"]},"target":{"type":"string"},"runner":{"type":"string"},"runner_version":{"type":"string"},"browser_version":{"type":"string"},"run_id":{"type":"string"},"started_at":{"type":"string"},"finished_at":{"type":"string"},"project_revision":{"type":"string"},"scenario_hash":{"type":"string"},"project_fingerprint":{"type":"string"},"dependency_fingerprint":{"type":"string"},"scenarios":{"type":"array"},"browser_engine":{"type":"string"},"runtime_errors":{"type":"array"},"network_errors":{"type":"array"},"fingerprint_spec":{"$ref":"fingerprint-v1.json"}}}
