{
  "schema": "lobster-runtime/v3",
  "status": "PASS",
  "target": "http://127.0.0.1:4176",
  "runner": "lobster-browser",
  "runner_version": "3.1.3",
  "browser_engine": "chromium",
  "browser_version": "153.0.8010.12",
  "run_id": "RUN-1788975255189",
  "started_at": "2026-09-09T17:34:15.189Z",
  "finished_at": "2026-09-09T17:34:15.189Z",
  "project_revision": "d4fd42a7cc29d916341e745e4def2d58a5d76de0",
  "scenario_hash": "d9baf85c03595db549e4e4a16b117c66193d88fb2adc2389a244303c4e05bc49",
  "project_fingerprint": "1937d503620eebbd1b33e0f43c388f141e0eb080f560e8c184dd0e3a0125c513",
  "fingerprint_spec": {
    "schema": "lobster-fingerprint/v1",
    "algorithm": "sha256-file-list/v1",
    "excluded_directories": [
      ".git",
      "node_modules"
    ],
    "excluded_paths": [
      "artifacts",
      "proof",
      "receipt-final.json"
    ],
    "symlink_policy": "record-as-leaf",
    "file_count": 6
  },
  "dependency_fingerprint": "2bcf3be63f267e29a5b50702020a5a782cd779e3e63cdb8c49cf6f8ce7b910d2",
  "runtime_errors": [],
  "network_errors": [],
  "scenarios": [
    {
      "id": "mobile-overflow-and-runtime",
      "status": "PASS",
      "viewport": {
        "width": 390,
        "height": 844
      },
      "steps": [
        {
          "action": "goto",
          "url": "/"
        },
        {
          "action": "screenshot",
          "path": "artifacts/final/mobile.png"
        }
      ],
      "assertions": [
        {
          "assert": "noHorizontalOverflow",
          "status": "PASS",
          "expected": true,
          "actual": true
        },
        {
          "assert": "noConsoleErrors",
          "status": "PASS",
          "expected": true,
          "actual": true
        },
        {
          "assert": "noFailedRequests",
          "status": "PASS",
          "expected": true,
          "actual": true
        }
      ],
      "failures": [],
      "console_errors": [],
      "page_errors": [],
      "runtime_errors": [],
      "network_errors": [],
      "artifacts": [
        {
          "kind": "screenshot",
          "path": "artifacts/final/mobile.png",
          "sha256": "5176e2f5772053d8701c2739209620afb0c1f6daef59d44fe20056fbe685c587"
        }
      ],
      "started_at": "2026-09-09T17:34:14.908Z",
      "finished_at": "2026-09-09T17:34:14.994Z"
    },
    {
      "id": "dialog-focus-restoration",
      "status": "PASS",
      "viewport": {
        "width": 1280,
        "height": 800
      },
      "steps": [
        {
          "action": "goto",
          "url": "/"
        },
        {
          "action": "click",
          "locator": {
            "css": "#open"
          }
        },
        {
          "action": "click",
          "locator": {
            "css": "#close"
          }
        },
        {
          "action": "screenshot",
          "path": "artifacts/final/dialog.png"
        }
      ],
      "assertions": [
        {
          "assert": "focused",
          "status": "PASS",
          "expected": true,
          "actual": true
        }
      ],
      "failures": [],
      "console_errors": [],
      "page_errors": [],
      "runtime_errors": [],
      "network_errors": [],
      "artifacts": [
        {
          "kind": "screenshot",
          "path": "artifacts/final/dialog.png",
          "sha256": "818bf5cf294b6f8d8516926434bf50f367183371a62f09101677e586e6fd0af4"
        }
      ],
      "started_at": "2026-09-09T17:34:14.994Z",
      "finished_at": "2026-09-09T17:34:15.156Z"
    },
    {
      "id": "forced-motion-fallback",
      "status": "PASS",
      "viewport": {
        "width": 390,
        "height": 844
      },
      "steps": [
        {
          "action": "goto",
          "url": "/"
        }
      ],
      "assertions": [
        {
          "assert": "text",
          "status": "PASS",
          "expected": "Fallback motion path",
          "actual": "Fallback motion path"
        }
      ],
      "failures": [],
      "console_errors": [],
      "page_errors": [],
      "runtime_errors": [],
      "network_errors": [],
      "artifacts": [],
      "started_at": "2026-09-09T17:34:15.156Z",
      "finished_at": "2026-09-09T17:34:15.189Z"
    }
  ]
}
